{
  "schema_version": 1,
  "forecast_version_id": "fcst-2026-preseason-bf554ba7c4aee595",
  "season": 2026,
  "model_id": "schedule-sim-v1",
  "model_state": "provisional",
  "as_of": "2026-08-27T14:54:14Z",
  "generated_at": "2026-08-27T14:54:14Z",
  "code_version": "schedule-sim-v1.0.1",
  "code_fingerprint": "sha256:df4c2a88e8779d0179f61dd462897de7098930b42f56e4dccbaed114bd5545b7",
  "input_versions": [
    "forecast-results-2010-2025-bf5e754ae255",
    "forecast-schedule-2026-e5a0856c531b",
    "adjustments-2026-zero-placeholder-v1"
  ],
  "policy_version": "forecast-policy-2026.1",
  "seed": 20260827,
  "draws": 100000,
  "fit_summary": {
    "selected_parameters": {
      "training_start_season": 2010,
      "home_field_ridge_penalty": 1,
      "recency_half_life_seasons": 1.5,
      "ridge_penalty": 12,
      "margin_cap_points": 21
    },
    "training_game_count": 4175,
    "effective_training_weight": 459.928694,
    "home_field_points": 1.523648,
    "residual_sd_points": 11.692416,
    "tie_probability": 0.00266
  },
  "simulation_summary": {
    "schedule_games": 272,
    "expected_team_wins": 271.27399,
    "expected_tied_games": 0.72601,
    "coherence_error": 2.6201263381153694e-14
  },
  "teams": [
    {
      "team_id": "ARI",
      "strength_mean_points": -2.276097,
      "strength_sd_points": 3.851873,
      "win_probability_mass": [
        0.0022,
        0.01045,
        0.02971,
        0.05751,
        0.08672,
        0.11751,
        0.1354,
        0.13966,
        0.12572,
        0.10537,
        0.08093,
        0.05272,
        0.03052,
        0.0159,
        0.0069,
        0.00219,
        0.00049,
        0.0001
      ],
      "expected_wins": 7.02209,
      "median_wins": 7,
      "interval_80": [
        4,
        11
      ]
    },
    {
      "team_id": "ATL",
      "strength_mean_points": -1.670482,
      "strength_sd_points": 3.852062,
      "win_probability_mass": [
        0.00124,
        0.00706,
        0.02035,
        0.04168,
        0.06843,
        0.0966,
        0.12311,
        0.13374,
        0.13248,
        0.11967,
        0.09759,
        0.069,
        0.04555,
        0.02619,
        0.01181,
        0.00412,
        0.00115,
        0.00023
      ],
      "expected_wins": 7.61265,
      "median_wins": 8,
      "interval_80": [
        4,
        11
      ]
    },
    {
      "team_id": "BAL",
      "strength_mean_points": 3.285185,
      "strength_sd_points": 3.852004,
      "win_probability_mass": [
        0.00002,
        0.00042,
        0.00131,
        0.00438,
        0.01123,
        0.02285,
        0.04087,
        0.06497,
        0.0924,
        0.11696,
        0.13555,
        0.14204,
        0.12893,
        0.10562,
        0.07251,
        0.03985,
        0.01593,
        0.00416
      ],
      "expected_wins": 10.44385,
      "median_wins": 11,
      "interval_80": [
        7,
        14
      ]
    },
    {
      "team_id": "BUF",
      "strength_mean_points": 4.314392,
      "strength_sd_points": 3.853689,
      "win_probability_mass": [
        0.00006,
        0.00035,
        0.00154,
        0.00449,
        0.01096,
        0.02197,
        0.04024,
        0.0642,
        0.09036,
        0.11554,
        0.13469,
        0.14186,
        0.13213,
        0.10644,
        0.07493,
        0.04066,
        0.01613,
        0.00345
      ],
      "expected_wins": 10.47646,
      "median_wins": 11,
      "interval_80": [
        7,
        14
      ]
    },
    {
      "team_id": "CAR",
      "strength_mean_points": -3.863855,
      "strength_sd_points": 3.851927,
      "win_probability_mass": [
        0.00489,
        0.0203,
        0.04824,
        0.08196,
        0.11365,
        0.13579,
        0.1407,
        0.13221,
        0.11058,
        0.08454,
        0.05738,
        0.0355,
        0.01925,
        0.00951,
        0.00395,
        0.00119,
        0.00033,
        0.00003
      ],
      "expected_wins": 6.30925,
      "median_wins": 6,
      "interval_80": [
        3,
        10
      ]
    },
    {
      "team_id": "CHI",
      "strength_mean_points": -0.587249,
      "strength_sd_points": 3.851947,
      "win_probability_mass": [
        0.00087,
        0.00497,
        0.01595,
        0.0346,
        0.06012,
        0.09008,
        0.11263,
        0.13104,
        0.1373,
        0.12398,
        0.10368,
        0.08001,
        0.05179,
        0.03084,
        0.01486,
        0.00549,
        0.0016,
        0.00019
      ],
      "expected_wins": 7.89736,
      "median_wins": 8,
      "interval_80": [
        4,
        12
      ]
    },
    {
      "team_id": "CIN",
      "strength_mean_points": -0.278148,
      "strength_sd_points": 3.853525,
      "win_probability_mass": [
        0.00044,
        0.00274,
        0.00923,
        0.02237,
        0.04103,
        0.06928,
        0.09347,
        0.11882,
        0.13116,
        0.1351,
        0.1202,
        0.09969,
        0.0719,
        0.04597,
        0.0244,
        0.01042,
        0.00322,
        0.00056
      ],
      "expected_wins": 8.57451,
      "median_wins": 9,
      "interval_80": [
        5,
        12
      ]
    },
    {
      "team_id": "CLE",
      "strength_mean_points": -2.982939,
      "strength_sd_points": 3.851853,
      "win_probability_mass": [
        0.0016,
        0.00833,
        0.02394,
        0.04686,
        0.07738,
        0.10734,
        0.12722,
        0.13767,
        0.13119,
        0.11372,
        0.09024,
        0.06109,
        0.03884,
        0.02048,
        0.00951,
        0.00348,
        0.001,
        0.00011
      ],
      "expected_wins": 7.35294,
      "median_wins": 7,
      "interval_80": [
        4,
        11
      ]
    },
    {
      "team_id": "DAL",
      "strength_mean_points": -0.052592,
      "strength_sd_points": 3.851945,
      "win_probability_mass": [
        0.0005,
        0.00322,
        0.0102,
        0.02448,
        0.04715,
        0.07449,
        0.10059,
        0.12284,
        0.13651,
        0.13332,
        0.11789,
        0.09276,
        0.06443,
        0.04045,
        0.02022,
        0.00826,
        0.0023,
        0.00039
      ],
      "expected_wins": 8.36217,
      "median_wins": 8,
      "interval_80": [
        5,
        12
      ]
    },
    {
      "team_id": "DEN",
      "strength_mean_points": 1.400261,
      "strength_sd_points": 3.85207,
      "win_probability_mass": [
        0.00026,
        0.00175,
        0.00603,
        0.0155,
        0.03053,
        0.05316,
        0.07897,
        0.10493,
        0.1243,
        0.13461,
        0.13125,
        0.11468,
        0.08767,
        0.06047,
        0.0338,
        0.01635,
        0.00484,
        0.0009
      ],
      "expected_wins": 9.08577,
      "median_wins": 9,
      "interval_80": [
        5,
        13
      ]
    },
    {
      "team_id": "DET",
      "strength_mean_points": 2.732674,
      "strength_sd_points": 3.851992,
      "win_probability_mass": [
        0.00007,
        0.00041,
        0.00185,
        0.00541,
        0.01377,
        0.02624,
        0.04796,
        0.07489,
        0.09893,
        0.12384,
        0.13837,
        0.13985,
        0.12199,
        0.09414,
        0.06293,
        0.03359,
        0.01295,
        0.00281
      ],
      "expected_wins": 10.1742,
      "median_wins": 10,
      "interval_80": [
        7,
        14
      ]
    },
    {
      "team_id": "GB",
      "strength_mean_points": 2.292961,
      "strength_sd_points": 3.85185,
      "win_probability_mass": [
        0.00006,
        0.00083,
        0.0032,
        0.00976,
        0.02137,
        0.03972,
        0.06338,
        0.09084,
        0.11555,
        0.13209,
        0.13679,
        0.12795,
        0.10445,
        0.07563,
        0.04647,
        0.0221,
        0.00835,
        0.00146
      ],
      "expected_wins": 9.6024,
      "median_wins": 10,
      "interval_80": [
        6,
        13
      ]
    },
    {
      "team_id": "HOU",
      "strength_mean_points": 0.651418,
      "strength_sd_points": 3.851944,
      "win_probability_mass": [
        0.00019,
        0.00174,
        0.00725,
        0.01724,
        0.03307,
        0.0571,
        0.08466,
        0.10964,
        0.13062,
        0.135,
        0.12862,
        0.10888,
        0.08363,
        0.05369,
        0.03033,
        0.01358,
        0.00398,
        0.00078
      ],
      "expected_wins": 8.91181,
      "median_wins": 9,
      "interval_80": [
        5,
        13
      ]
    },
    {
      "team_id": "IND",
      "strength_mean_points": -0.435065,
      "strength_sd_points": 3.852034,
      "win_probability_mass": [
        0.00063,
        0.00334,
        0.01021,
        0.02395,
        0.04546,
        0.07274,
        0.10025,
        0.12062,
        0.13351,
        0.13325,
        0.11921,
        0.09458,
        0.06771,
        0.04124,
        0.02135,
        0.0088,
        0.00275,
        0.0004
      ],
      "expected_wins": 8.41714,
      "median_wins": 8,
      "interval_80": [
        5,
        12
      ]
    },
    {
      "team_id": "JAX",
      "strength_mean_points": 0.202853,
      "strength_sd_points": 3.851887,
      "win_probability_mass": [
        0.00044,
        0.00243,
        0.00799,
        0.01935,
        0.03722,
        0.06341,
        0.08945,
        0.11276,
        0.13166,
        0.13478,
        0.12573,
        0.10517,
        0.07632,
        0.05003,
        0.02674,
        0.0124,
        0.00361,
        0.00051
      ],
      "expected_wins": 8.7419,
      "median_wins": 9,
      "interval_80": [
        5,
        12
      ]
    },
    {
      "team_id": "KC",
      "strength_mean_points": 2.644129,
      "strength_sd_points": 3.8521,
      "win_probability_mass": [
        0.00011,
        0.00071,
        0.00309,
        0.00809,
        0.01851,
        0.03615,